[
  {
    "parcel_id": "1010378015",
    "address": "102 S Clinton St",
    "year_built": 1900,
    "renovation_notes": "Renovated in 2000",
    "building_class": "B",
    "gross_leasable_area": 41939.0,
    "jurisdiction": "Iowa City",
    "assessed_value": 13168420.0,
    "assessed_value_per_sf": 313.0,
    "market_rent": 18.0,
    "vacancy_rate": 0.094,
    "cap_rate_used": 0.095,
    "valuation_method_used": "Income + Sales"
  }
]